{
  "schema": "torchsynth-render-artifact",
  "schema_version": 1,
  "status": "complete",
  "artifact_id": "ra1-be7fdf9f52bd498ce2af9500b9cf159fffb26dfe37b3a5056ee830c507277585",
  "inputs": {
    "state": "available",
    "value": {
      "profile": {
        "name": "torchsynth-1-voice-default",
        "contract_sha256": "1d24ab0f9af5358f7d2078350ed66bed8aaf3956d275b4a80c30440b4c759471",
        "sample_rate": 44100,
        "control_rate": 441,
        "duration_seconds": 4,
        "expected_sample_count": 176400,
        "channels": 1,
        "dtype": "float32",
        "nebula": "default",
        "normalization": "conditional-whole-clip-peak"
      },
      "source": {
        "commit": "2b0964d4c6c3d472a2a0d54d91b408caaeffca6d",
        "manifest_sha256": "565236e22ad8b1dcd620783024a114b0960e5534b1cb26e8dcf8dafc9c96c0af",
        "files": {
          "torchsynth/config.py": "0a0fbd308aacbf54a9b3ddf91825f2084857fd018ab928a8297af8f8b02c5264",
          "torchsynth/module.py": "f2450efee7cfa5a450238885db636cb673d6dd3c731983dc08ccc0a0e42faa8c",
          "torchsynth/nebulae/voice/default.json": "29818c50a2b9ece101d3952edc746a75fb7d043f2d68624f356c66b83bbeae24",
          "torchsynth/parameter.py": "db4e81bff3e930293b3e74377053e9b3d485b0939ad4ac6dd63b34bbc523a7a3",
          "torchsynth/synth.py": "64b3c2909757f944397e4243425ceab889e6b71472445fa6710c734edb4d28f3",
          "torchsynth/util.py": "d16a313640d2edd3f22e930e0b0e807b88c5c2cf71aba35c9107f7267231b333"
        }
      },
      "runtime": {
        "lock_sha256": "aaaaaaaaaaaaaaaaaaaaaaaaaaaaaaaaaaaaaaaaaaaaaaaaaaaaaaaaaaaaaaaa",
        "os": "synthetic-os",
        "architecture": "synthetic-arch",
        "cpu": "synthetic-cpu",
        "device": "cpu",
        "versions": {
          "python": "synthetic",
          "torch": "synthetic",
          "lightning": "synthetic",
          "numpy": "synthetic",
          "torchsynth": "synthetic"
        }
      },
      "project_git": {
        "commit": "bbbbbbbbbbbbbbbbbbbbbbbbbbbbbbbbbbbbbbbb",
        "dirty": false,
        "diff_sha256": "e3b0c44298fc1c149afbf4c8996fb92427ae41e4649b934ca495991b7852b855",
        "untracked_sha256": "51d865c4d0211f7540b0b6bbd76c09de62cf66b70ec13707b1c783257bc4d927"
      },
      "renderer_version": "synthetic-v1",
      "fixture": {
        "sound_index": 39942,
        "upstream_batch_index": 312,
        "upstream_slot": 6,
        "upstream_name": "synth1B1-312-6",
        "is_train": false
      },
      "execution": {
        "mode": "canonical-batch",
        "batch_size": 32,
        "reproducible": true
      },
      "parameters": {
        "normalized_by_name": {
          "synthetic.p00": 0.5,
          "synthetic.p01": 0.5,
          "synthetic.p02": 0.5,
          "synthetic.p03": 0.5,
          "synthetic.p04": 0.5,
          "synthetic.p05": 0.5,
          "synthetic.p06": 0.5,
          "synthetic.p07": 0.5,
          "synthetic.p08": 0.5,
          "synthetic.p09": 0.5,
          "synthetic.p10": 0.5,
          "synthetic.p11": 0.5,
          "synthetic.p12": 0.5,
          "synthetic.p13": 0.5,
          "synthetic.p14": 0.5,
          "synthetic.p15": 0.5,
          "synthetic.p16": 0.5,
          "synthetic.p17": 0.5,
          "synthetic.p18": 0.5,
          "synthetic.p19": 0.5,
          "synthetic.p20": 0.5,
          "synthetic.p21": 0.5,
          "synthetic.p22": 0.5,
          "synthetic.p23": 0.5,
          "synthetic.p24": 0.5,
          "synthetic.p25": 0.5,
          "synthetic.p26": 0.5,
          "synthetic.p27": 0.5,
          "synthetic.p28": 0.5,
          "synthetic.p29": 0.5,
          "synthetic.p30": 0.5,
          "synthetic.p31": 0.5,
          "synthetic.p32": 0.5,
          "synthetic.p33": 0.5,
          "synthetic.p34": 0.5,
          "synthetic.p35": 0.5,
          "synthetic.p36": 0.5,
          "synthetic.p37": 0.5,
          "synthetic.p38": 0.5,
          "synthetic.p39": 0.5,
          "synthetic.p40": 0.5,
          "synthetic.p41": 0.5,
          "synthetic.p42": 0.5,
          "synthetic.p43": 0.5,
          "synthetic.p44": 0.5,
          "synthetic.p45": 0.5,
          "synthetic.p46": 0.5,
          "synthetic.p47": 0.5,
          "synthetic.p48": 0.5,
          "synthetic.p49": 0.5,
          "synthetic.p50": 0.5,
          "synthetic.p51": 0.5,
          "synthetic.p52": 0.5,
          "synthetic.p53": 0.5,
          "synthetic.p54": 0.5,
          "synthetic.p55": 0.5,
          "synthetic.p56": 0.5,
          "synthetic.p57": 0.5,
          "synthetic.p58": 0.5,
          "synthetic.p59": 0.5,
          "synthetic.p60": 0.5,
          "synthetic.p61": 0.5,
          "synthetic.p62": 0.5,
          "synthetic.p63": 0.5,
          "synthetic.p64": 0.5,
          "synthetic.p65": 0.5,
          "synthetic.p66": 0.5,
          "synthetic.p67": 0.5,
          "synthetic.p68": 0.5,
          "synthetic.p69": 0.5,
          "synthetic.p70": 0.5,
          "synthetic.p71": 0.5,
          "synthetic.p72": 0.5,
          "synthetic.p73": 0.5,
          "synthetic.p74": 0.5,
          "synthetic.p75": 0.5,
          "synthetic.p76": 0.5,
          "synthetic.p77": 0.5
        },
        "physical_by_name": {
          "synthetic.p00": 0.5,
          "synthetic.p01": 0.5,
          "synthetic.p02": 0.5,
          "synthetic.p03": 0.5,
          "synthetic.p04": 0.5,
          "synthetic.p05": 0.5,
          "synthetic.p06": 0.5,
          "synthetic.p07": 0.5,
          "synthetic.p08": 0.5,
          "synthetic.p09": 0.5,
          "synthetic.p10": 0.5,
          "synthetic.p11": 0.5,
          "synthetic.p12": 0.5,
          "synthetic.p13": 0.5,
          "synthetic.p14": 0.5,
          "synthetic.p15": 0.5,
          "synthetic.p16": 0.5,
          "synthetic.p17": 0.5,
          "synthetic.p18": 0.5,
          "synthetic.p19": 0.5,
          "synthetic.p20": 0.5,
          "synthetic.p21": 0.5,
          "synthetic.p22": 0.5,
          "synthetic.p23": 0.5,
          "synthetic.p24": 0.5,
          "synthetic.p25": 0.5,
          "synthetic.p26": 0.5,
          "synthetic.p27": 0.5,
          "synthetic.p28": 0.5,
          "synthetic.p29": 0.5,
          "synthetic.p30": 0.5,
          "synthetic.p31": 0.5,
          "synthetic.p32": 0.5,
          "synthetic.p33": 0.5,
          "synthetic.p34": 0.5,
          "synthetic.p35": 0.5,
          "synthetic.p36": 0.5,
          "synthetic.p37": 0.5,
          "synthetic.p38": 0.5,
          "synthetic.p39": 0.5,
          "synthetic.p40": 0.5,
          "synthetic.p41": 0.5,
          "synthetic.p42": 0.5,
          "synthetic.p43": 0.5,
          "synthetic.p44": 0.5,
          "synthetic.p45": 0.5,
          "synthetic.p46": 0.5,
          "synthetic.p47": 0.5,
          "synthetic.p48": 0.5,
          "synthetic.p49": 0.5,
          "synthetic.p50": 0.5,
          "synthetic.p51": 0.5,
          "synthetic.p52": 0.5,
          "synthetic.p53": 0.5,
          "synthetic.p54": 0.5,
          "synthetic.p55": 0.5,
          "synthetic.p56": 0.5,
          "synthetic.p57": 0.5,
          "synthetic.p58": 0.5,
          "synthetic.p59": 0.5,
          "synthetic.p60": 0.5,
          "synthetic.p61": 0.5,
          "synthetic.p62": 0.5,
          "synthetic.p63": 0.5,
          "synthetic.p64": 0.5,
          "synthetic.p65": 0.5,
          "synthetic.p66": 0.5,
          "synthetic.p67": 0.5,
          "synthetic.p68": 0.5,
          "synthetic.p69": 0.5,
          "synthetic.p70": 0.5,
          "synthetic.p71": 0.5,
          "synthetic.p72": 0.5,
          "synthetic.p73": 0.5,
          "synthetic.p74": 0.5,
          "synthetic.p75": 0.5,
          "synthetic.p76": 0.5,
          "synthetic.p77": 0.5
        },
        "locks_physical": {}
      },
      "noise": {
        "seed": 13,
        "slot": 6,
        "sha256": "cccccccccccccccccccccccccccccccccccccccccccccccccccccccccccccccc"
      },
      "trace_registry_version": "synthetic-v1",
      "requested_traces": []
    }
  },
  "audio": {
    "state": "available",
    "value": {
      "file": {
        "ref": "synthetic/audio.f32le",
        "sha256": "bbbf3baab8a5dc22f0ccabe9c9e753a0ec5a58713d6eab66ea37813498a1625a",
        "size_bytes": 705600
      },
      "encoding": "f32le-mono",
      "observed_sample_count": 176400,
      "peak_abs": 0,
      "peak_index": 0,
      "rms": 0,
      "dc_mean": 0,
      "clipped_sample_count": 0,
      "normalization_gain": 1
    }
  },
  "traces": {
    "state": "available",
    "value": {}
  },
  "warnings": [
    "synthetic-fixture-not-rendered"
  ],
  "failures": []
}
